{
  "schemaVersion": 1,
  "generatedAt": "2026-08-04T15:45:03.011Z",
  "generatedByHost": "Machine A (192.168.214.2, retired compatibility host)",
  "sourceRepo": "C:/Users/joshp/Desktop/ToolsEnabled",
  "health": {
    "available": true,
    "path": "state/health-snapshot.json",
    "observedAtMs": 1785805283686,
    "observedAt": "2026-08-04T01:01:23.686Z",
    "subsystems": [
      {
        "id": "dashboard",
        "state": "OK",
        "reason": "all four rungs verified"
      },
      {
        "id": "jarvis",
        "state": "OK",
        "reason": "all four rungs verified"
      },
      {
        "id": "fleet-supervisor",
        "state": "STOPPED",
        "reason": "stop sentinel state/fleet-supervisor.stop is present: this subsystem was stopped on purpose"
      },
      {
        "id": "telegram-bridge",
        "state": "DOWN",
        "reason": "pid 9884 from state/telegram-bridge.pid.lock is not running (stale lock)"
      },
      {
        "id": "agent-digest",
        "state": "DOWN",
        "reason": "scheduled task 'ToolsEnabled Agent Digest' is 'Disabled', not Running"
      },
      {
        "id": "uac-delegation-helper",
        "state": "UNKNOWN",
        "reason": "not verifiable: alive (On-demand by design: this helper is started per elevated request and exits immediately afterward, so 'not running' is its correct steady state and a liveness probe would report a false alarm on every sweep.); functioning (Exercising this rung would require performing a real elevated operation on every health sweep, which is a far worse idea than accepting a declared blind spot; its failures surface through the audited client call instead.)"
      },
      {
        "id": "health-observer",
        "state": "DOWN",
        "reason": "pid 43732 from state/health-observer.pid.lock is not running (stale lock)"
      },
      {
        "id": "coordinator-duty-host",
        "state": "DOWN",
        "reason": "pid 21576 from state/coordinator-duty-host.pid.lock is not running (stale lock)"
      },
      {
        "id": "owner-host",
        "state": "DOWN",
        "reason": "named pipe ToolsEnabled.OwnerHost.V1 is absent: the owner host is not listening"
      },
      {
        "id": "tunnel-bridge-keeper",
        "state": "DOWN",
        "reason": "scheduled task 'ToolsEnabled Tunnel Bridge Keeper' is NOT registered, so the OS cannot start or restart this subsystem"
      },
      {
        "id": "fra-keeper",
        "state": "DOWN",
        "reason": "scheduled task 'ToolsEnabled FRA Keeper' is NOT registered, so the OS cannot start or restart this subsystem"
      }
    ],
    "counts": {
      "OK": 2,
      "DOWN": 7,
      "STOPPED": 1,
      "UNKNOWN": 1,
      "OTHER": 0
    },
    "total": 11
  },
  "peerLink": {
    "outbound": {
      "available": true,
      "path": "state/full-remote-access-peer-liveness.json",
      "authenticatedAt": "2026-08-04T15:42:30.660Z",
      "authenticatedAtMs": 1785858150660,
      "localHost": "192.168.214.2",
      "peerHost": "192.168.214.1"
    },
    "inbound": {
      "available": true,
      "path": "state/full-remote-access-inbound-liveness.json",
      "authenticatedAt": "2026-08-04T15:43:09.962Z",
      "authenticatedAtMs": 1785858189962,
      "localHost": "192.168.214.2",
      "peerHost": "192.168.214.1"
    }
  },
  "recentLanes": {
    "available": true,
    "path": "state/agent-churn-ledger.jsonl",
    "items": [
      {
        "event": "lane-end",
        "laneId": "ONESHOT-OPERATOR",
        "model": "gpt-5.6-sol",
        "outcome": "completed",
        "exitCode": 0,
        "durationMs": 625467,
        "at": "2026-08-04T06:29:39.611Z",
        "atMs": 1785824979611
      },
      {
        "event": "lane-start",
        "laneId": "ONESHOT-OPERATOR",
        "model": "gpt-5.6-sol",
        "outcome": null,
        "exitCode": null,
        "durationMs": null,
        "at": "2026-08-04T06:19:14.143Z",
        "atMs": 1785824354143
      },
      {
        "event": "lane-end",
        "laneId": "DIRECTIVE-RELAY-3",
        "model": "gpt-5.6-sol",
        "outcome": "completed",
        "exitCode": 0,
        "durationMs": 1867149,
        "at": "2026-08-04T04:28:58.723Z",
        "atMs": 1785817738723
      },
      {
        "event": "lane-start",
        "laneId": "DIRECTIVE-RELAY-3",
        "model": "gpt-5.6-sol",
        "outcome": null,
        "exitCode": null,
        "durationMs": null,
        "at": "2026-08-04T03:57:51.574Z",
        "atMs": 1785815871574
      },
      {
        "event": "lane-end",
        "laneId": "QUEUE-BACKFILL",
        "model": "gpt-5.6-sol",
        "outcome": "completed",
        "exitCode": 0,
        "durationMs": 1471009,
        "at": "2026-08-04T01:11:08.668Z",
        "atMs": 1785805868668
      },
      {
        "event": "lane-end",
        "laneId": "DIRECTIVE-RELAY-2",
        "model": "gpt-5.6-sol",
        "outcome": "completed",
        "exitCode": 0,
        "durationMs": 385574,
        "at": "2026-08-04T00:51:25.280Z",
        "atMs": 1785804685280
      },
      {
        "event": "lane-start",
        "laneId": "QUEUE-BACKFILL",
        "model": "gpt-5.6-sol",
        "outcome": null,
        "exitCode": null,
        "durationMs": null,
        "at": "2026-08-04T00:46:37.659Z",
        "atMs": 1785804397659
      },
      {
        "event": "lane-start",
        "laneId": "DIRECTIVE-RELAY-2",
        "model": "gpt-5.6-sol",
        "outcome": null,
        "exitCode": null,
        "durationMs": null,
        "at": "2026-08-04T00:44:59.706Z",
        "atMs": 1785804299706
      },
      {
        "event": "lane-start",
        "laneId": "DIRECTIVE-RELAY",
        "model": "gpt-5.6-sol",
        "outcome": null,
        "exitCode": null,
        "durationMs": null,
        "at": "2026-08-04T00:44:04.913Z",
        "atMs": 1785804244913
      },
      {
        "event": "lane-end",
        "laneId": "FABRIC-WIRE",
        "model": "gpt-5.6-sol",
        "outcome": "completed",
        "exitCode": 0,
        "durationMs": 1810590,
        "at": "2026-08-04T00:00:28.265Z",
        "atMs": 1785801628265
      },
      {
        "event": "lane-start",
        "laneId": "FABRIC-WIRE",
        "model": "gpt-5.6-sol",
        "outcome": null,
        "exitCode": null,
        "durationMs": null,
        "at": "2026-08-03T23:30:17.675Z",
        "atMs": 1785799817675
      },
      {
        "event": "lane-end",
        "laneId": "JARVIS-BRINGUP",
        "model": "gpt-5.6-sol",
        "outcome": "completed",
        "exitCode": 0,
        "durationMs": 706145,
        "at": "2026-08-03T22:25:37.584Z",
        "atMs": 1785795937584
      }
    ]
  },
  "hostUptime": {
    "available": true,
    "seconds": 382680.625,
    "hostLabel": "Machine A (192.168.214.2, retired compatibility host)"
  }
}